producto,precio,link,fecha
Heladera No Frost Patrick HPK350M00B    Blanca 271 Lts.,$67.999,https://www.garbarino.com/producto/heladera-no-frost-patrick-hpk350m00b-blanca-271-lts./ad5d3327b2,
Heladera con Freezer KOHINOOR KGA-4094/8 Acero Inoxidable 358 L,$95.999,https://www.garbarino.com/producto/heladera-con-freezer-kohinoor-kga-40948-acero-inoxidable-358-l/e1aa78c2af,
Heladera con Freezer Patrick HPK151M11N01 Negro 388 Lts.,$67.999,https://www.garbarino.com/producto/heladera-con-freezer-patrick-hpk151m11n01-negro-388-lts./19f57a7dc9,
Heladera con Freezer Patrick HPK141M00B Blanco,$47.999,https://www.garbarino.com/producto/heladera-con-freezer-patrick-hpk141m00b-blanco/6797a6d728,
Heladera con Freezer Patrick HPK135M00B01   Blanco 264 Lts.,$40.999,https://www.garbarino.com/producto/heladera-con-freezer-patrick-hpk135m00b01-blanco-264-lts./fbe882d1a1,
Heladera con Freezer Philco PHCT340B/01 Blanco 326 Lts.,$58.999,https://www.garbarino.com/producto/heladera-con-freezer-philco-phct340b01-blanco-326-lts./8ce150306e,
Heladera con Freezer COLUMBIA CHD32/7 Blanco 309 Lts.,$49.850,https://www.garbarino.com/producto/heladera-con-freezer-columbia-chd327-blanco-309-lts./6c2d3c9c21,
Heladera con Freezer Philco PHCT340N-01 Negro 326 Lts.,$74.999,https://www.garbarino.com/producto/heladera-con-freezer-philco-phct340n-01-negro-326-lts./13ff33d3b3,
Heladera No Frost Kohinoor KHDA41D/8 Acero Inoxidable 388 Lts.,$89.999,https://www.garbarino.com/producto/heladera-no-frost-kohinoor-khda41d8-acero-inoxidable-388-lts./71582a928e,
Heladera SBS Patrick PQP458BKRSS0 Acero Inoxidable 459 Lts.,$169.999,https://www.garbarino.com/producto/heladera-sbs-patrick-pqp458bkrss0-acero-inoxidable-459-lts./6a365fdf0b,
Heladera SBS Peabody PE-SBS67 Acero Inoxidable 516 Lts.,$229.000,https://www.garbarino.com/producto/heladera-sbs-peabody-pe-sbs67-acero-inoxidable-516-lts./2ad064138b,
Heladera con Freezer Siam HSI-NT30BD Blanco 358 Lts.,$99.799,https://www.garbarino.com/producto/heladera-con-freezer-siam-hsi-nt30bd-blanco-358-lts./6fa619a48d,
Heladera con Freezer Philco PHCT340X/01 Acero Inoxidable 326 Lts.,$57.999,https://www.garbarino.com/producto/heladera-con-freezer-philco-phct340x01-acero-inoxidable-326-lts./76ed7245db,
Heladera con Freezer Coventry 2F1600Ba Blanca 330 L,$44.999,https://www.garbarino.com/producto/heladera-con-freezer-coventry-2f1600ba-blanca-330-l/49ce45dcb0,
Heladera con Freezer Philco PHCT320B Blanco 314 Lts.,$63.839,https://www.garbarino.com/producto/heladera-con-freezer-philco-phct320b-blanco-314-lts./78da7596f4,
Heladera con Freezer Philco PHCT320B Blanca,$55.999,https://www.garbarino.com/producto/heladera-con-freezer-philco-phct320b-blanca/0b9a3a9311,
Heladera con Freezer Philco PHCT360X/01 Acero Inoxidable 349 Lts.,$66.999,https://www.garbarino.com/producto/heladera-con-freezer-philco-phct360x01-acero-inoxidable-349-lts./a70c6581e1,
Heladera con Freezer Philco PHCC340X Acero Inoxidable 294 Lts.,$76.439,https://www.garbarino.com/producto/heladera-con-freezer-philco-phcc340x-acero-inoxidable-294-lts./04ca3c7b4c,
Heladera con Freezer Philco PHCT290B/01 Blanco 285 Litros,$49.999,https://www.garbarino.com/producto/heladera-con-freezer-philco-phct290b01-blanco-285-litros/b37943a5bd,
Heladera con Freezer Vostok KD420F Blanco 420 Lts.,$48.999,https://www.garbarino.com/producto/heladera-con-freezer-vostok-kd420f-blanco-420-lts./d1f61a7faa,
Heladera con Freezer Philco PHCT260B Blanco 255 Lts.,$51.999,https://www.garbarino.com/producto/heladera-con-freezer-philco-phct260b-blanco-255-lts./50591176a2,
Heladera con Freezer Philco PHCT360B/01 Blanco 349 Lts.,$54.899,https://www.garbarino.com/producto/heladera-con-freezer-philco-phct360b01-blanco-349-lts./cb3341dad9,
Heladera con Freezer Philco PHCT290X/01 Acero Inoxidable 273 Lts.,$51.999,https://www.garbarino.com/producto/heladera-con-freezer-philco-phct290x01-acero-inoxidable-273-lts./9553758118,
Purificador de Agua DVIGI Para Heladera,$1.999,https://www.garbarino.com/producto/purificador-de-agua-dvigi-para-heladera/dcd87b13f7,
"Conservadora Eléctrica de PVC, Plástico, Poliéster Black & Decker Heladera Pórtatil 12V (BDC24L) Negro 24 Lts.",$14.990,https://www.garbarino.com/producto/conservadora-electrica-de-pvc-plastico-poliester-black-decker-heladera-portatil-12v-bdc24l-negro-24-lts./0b05b20078,
Heladera Exhibidora Vertical Inelro MT-380 390 Lts.,$64.999,https://www.garbarino.com/producto/heladera-exhibidora-vertical-inelro-mt-380-390-lts./57e8891455,
Heladera Exhibidora Vertical Inelro MT-470 470 Lts.,$72.999,https://www.garbarino.com/producto/heladera-exhibidora-vertical-inelro-mt-470-470-lts./37732aedd4,
Heladera Exhibidora Vertical Inelro MT-17 ECO 470 Lts.,$83.999,https://www.garbarino.com/producto/heladera-exhibidora-vertical-inelro-mt-17-eco-470-lts./f19cd8b7fe,
Heladera Sin Freezer Vondom Frigobar RFG48B 48 Lts.,$27.500,https://www.garbarino.com/producto/heladera-sin-freezer-vondom-frigobar-rfg48b-48-lts./035f0b011a,
Heladera Exhibidora Vertical Inelro MT-300 300 Lts.,$55.999,https://www.garbarino.com/producto/heladera-exhibidora-vertical-inelro-mt-300-300-lts./4aa303d4de,
Heladera Exhibidora Vertical Inelro MT-750 765 Lts.,$135.999,https://www.garbarino.com/producto/heladera-exhibidora-vertical-inelro-mt-750-765-lts./2772479c0b,
Heladera Sin Freezer Vondom Frigrobar RFG70N 70 Lts.,$33.000,https://www.garbarino.com/producto/heladera-sin-freezer-vondom-frigrobar-rfg70n-70-lts./a08ebe3514,
Heladera Sin Freezer Vostok VKS-48RVI 50 Lts.,$24.999,https://www.garbarino.com/producto/heladera-sin-freezer-vostok-vks-48rvi-50-lts./e7458b7acc,
Heladera Sin Freezer Patrick HPK120P00B 120 Lts.,$37.999,https://www.garbarino.com/producto/heladera-sin-freezer-patrick-hpk120p00b-120-lts./5f077183f4,
Heladera Sin Freezer Inelro MT120 Cervecera 106 Lts.,$54.999,https://www.garbarino.com/producto/heladera-sin-freezer-inelro-mt120-cervecera-106-lts./e6e8c6fe80,
